{
  "schemaVersion": "0.3.0",
  "id": "prototype.study",
  "projectId": "project.paper",
  "projectRevision": "example-v2",
  "pageId": "page.scratch",
  "documentRevision": 1,
  "dependencyRevisions": [
    {
      "sourceId": "project.motion",
      "revision": "example-v2"
    },
    {
      "sourceId": "project.defaults",
      "revision": "example-v2"
    },
    {
      "sourceId": "project.components",
      "revision": "example-v2"
    }
  ],
  "selection": {
    "kind": "sequence",
    "sequenceId": "sequence.study"
  },
  "adapterId": "example.web-dom",
  "targetId": "web-dom",
  "requiredCapabilities": [
    "compose-instances",
    "evaluate-translation",
    "resolve-project-tokens",
    "evaluate-discrete-visibility"
  ],
  "unsupportedPolicy": "fail-on-unsupported",
  "output": {
    "root": "prototype/button-study",
    "conflictPolicy": "fail-if-exists"
  }
}
